question,optionA,optionB,optionC,optionD,optionE,answer,reference_text,pages,industries,pairing_explanation,qa_type
"Give me all the metrics from Table 1 that are in category 'Discussion and Analysis' for Apparel, Accessories & Footwear, Appliance Manufacturing, and Building Products & Furnishings industries.","CG-AA-440a.1, CG-AM-410a.3, CG-BF-410a.1","CG-AA-440a.1, CG-AM-410a.2, CG-BF-410a.1","CG-AA-440a.2, CG-AM-410a.3, CG-BF-410a.1","CG-AA-440a.1, CG-AM-410a.3, CG-BF-430a.1","CG-AA-440a.2, CG-AM-410a.2, CG-BF-410a.2",C,"['CG-AA-440a.1. Description of environmental and social risks associated with sourcing priority raw materials', ""CG-AM-410a.3. Description of efforts to manage products' end-of-life impacts"", 'CG-BF-410a.1. Description of efforts to manage product lifecycle impacts and meet demand for sustainable products']","['8_b1', '14_b2', '18_b3']","['b1-apparel-accessories-and-footwear', 'b2-appliance-manufacturing', 'b3-building-products-and-furnishings']","These industries all involve consumer goods that have significant global supply chains, environmental impacts from manufacturing, and considerations around labor practices in emerging markets.",single_hop
"What formulas are used to calculate CG-AA-440a.2 metric in Apparel, Accessories & Footwear industry?",The percentage shall be calculated as the weight of raw materials third-party certified to an environmental and/or social standard divided by the total weight of raw materials that compose the entity's finished products.,The percentage shall be calculated as the weight of raw materials third-party certified to an environmental and/or social standard divided by the total revenue from finished products.,The percentage shall be calculated as the revenue from raw materials third-party certified to an environmental and/or social standard divided by the total weight of raw materials that compose the entity's finished products.,The percentage shall be calculated as the revenue from raw materials third-party certified to an environmental and/or social standard divided by the total revenue from finished products.,No formula is provided for calculating this metric.,A,"[""1.3 The entity shall calculate the percentage as the weight of raw materials third-party certified to an environmental and/or social standard divided by the total weight of raw materials that compose the entity's finished products.""]",['9_b1'],"['b1-apparel-accessories-and-footwear', 'b2-appliance-manufacturing', 'b3-building-products-and-furnishings']","These industries all involve consumer goods that have significant global supply chains, environmental impacts from manufacturing, and considerations around labor practices in emerging markets.",single_hop
Which industry has more 'Quantitative' metrics to disclose in Table 1 between Appliance Manufacturing and Building Products & Furnishings industries?,Appliance Manufacturing has more quantitative metrics in Table 1.,Building Products & Furnishings has more quantitative metrics in Table 1.,Both industries have an equal number of quantitative metrics in Table 1.,Neither industry has any quantitative metrics listed in Table 1.,The information to determine this is not provided in the document.,B,"['For Appliance Manufacturing, Table 1 shows 2 quantitative metrics: CG-AM-410a.1, CG-AM-410a.2', 'For Building Products & Furnishings, Table 1 shows 3 quantitative metrics: CG-BF-130a.1, CG-BF-410a.2, CG-BF-430a.1']","['11_b2', '15_b3']","['b1-apparel-accessories-and-footwear', 'b2-appliance-manufacturing', 'b3-building-products-and-furnishings']","These industries all involve consumer goods that have significant global supply chains, environmental impacts from manufacturing, and considerations around labor practices in emerging markets.",single_hop
"Are there any common sustainability topics between Apparel, Accessories & Footwear, Appliance Manufacturing, and Building Products & Furnishings industries?","No, there are no common sustainability topics across the three industries.","Yes, the common sustainability topic is Raw Materials Sourcing.","Yes, the common sustainability topic is Product Lifecycle Environmental Impacts.","Yes, the common sustainability topics are Raw Materials Sourcing and Product Lifecycle Environmental Impacts.","Yes, the common sustainability topic is Energy Management in Manufacturing.",C,"['Topics for Apparel, Accessories & Footwear include Raw Materials Sourcing', 'Topics for Appliance Manufacturing include Product Lifecycle Environmental Impacts', 'Topics for Building Products & Furnishings include Product Lifecycle Environmental Impacts']","['7_b1', '11_b2', '15_b3']","['b1-apparel-accessories-and-footwear', 'b2-appliance-manufacturing', 'b3-building-products-and-furnishings']","These industries all involve consumer goods that have significant global supply chains, environmental impacts from manufacturing, and considerations around labor practices in emerging markets.",single_hop
"What units of measurement are used across the Apparel, Accessories & Footwear, Appliance Manufacturing, and Building Products & Furnishings industries for measuring energy consumption?",Kilowatt hours (kWh),"Gigajoules (GJ), Percentage (%)",British thermal units (BTUs),"Metric tons (t), Percentage (%)",Square meters (m²),B,"['The entity shall disclose (1) the total amount of energy it consumed as an aggregate figure, in gigajoules (GJ).', 'The entity shall disclose (2) the percentage of energy it consumed that was supplied from grid electricity.', 'The entity shall disclose (3) the percentage of energy it consumed that is renewable energy.']",['16_b3'],"['b1-apparel-accessories-and-footwear', 'b2-appliance-manufacturing', 'b3-building-products-and-furnishings']","These industries all involve consumer goods that have significant global supply chains, environmental impacts from manufacturing, and considerations around labor practices in emerging markets.",multi_hop
"Give me the codes for all the 'Discussion and Analysis' metrics in Table 1 for the Apparel, Accessories & Footwear, Appliance Manufacturing, and Building Products & Furnishings industries.","CG-AA-440a.1, CG-BF-410a.1","CG-AM-410a.3, CG-BF-410a.1",CG-BF-410a.1,CG-AA-440a.1,CG-AM-410a.3,B,"['Description of environmental and social risks associated with sourcing priority raw materials', ""Description of efforts to manage products' end-of-life impacts"", 'Description of efforts to manage product lifecycle impacts and meet demand for sustainable products']","['7_b1', '13_b2', '18_b3']","['b1-apparel-accessories-and-footwear', 'b2-appliance-manufacturing', 'b3-building-products-and-furnishings']","These industries all involve consumer goods that have significant global supply chains, environmental impacts from manufacturing, and considerations around labor practices in emerging markets.",multi_hop
How does the calculation of energy consumption-related metrics differ between Appliance Manufacturing and Building Products & Furnishings companies?,"Appliance companies calculate renewable energy as a percentage of total energy, while Building Products companies calculate grid electricity as a percentage.","Appliance companies do not need to calculate energy consumption metrics, while Building Products companies must disclose total energy, percentage grid electricity, and percentage renewable.",There is no difference in how the metrics are calculated for the two industries.,"Appliance companies must only disclose percentage grid electricity, while Building Products companies must disclose total energy consumed and percentage renewable.","Appliance companies disclose total energy, percentage grid electricity, and percentage renewable energy. Building Products companies do not have any such disclosure requirements.",C,"['The entity shall disclose (1) the total amount of energy it consumed as an aggregate figure, in gigajoules (GJ).', 'The entity shall disclose (2) the percentage of energy it consumed that was supplied from grid electricity.', 'The entity shall disclose (3) the percentage of energy it consumed that is renewable energy.']",['16_b3'],"['b1-apparel-accessories-and-footwear', 'b2-appliance-manufacturing', 'b3-building-products-and-furnishings']","These industries all involve consumer goods that have significant global supply chains, environmental impacts from manufacturing, and considerations around labor practices in emerging markets.",multi_hop
"When calculating metrics related to third-party certified raw materials, what is the key difference between Apparel, Accessories & Footwear and Building Products & Furnishings companies?","Apparel companies calculate by weight, while Building Products companies calculate by revenue.","Apparel companies calculate certified raw materials as a percentage of total raw materials by weight, while Building Products companies calculate certified wood fiber as a percentage of total wood fiber by weight.",There is no difference in how the certified raw material metrics are calculated for the two industries.,Apparel companies do not have any disclosure requirements related to certified raw materials.,Building Products companies do not have any disclosure requirements related to certified raw materials.,B,"[""The entity shall calculate the percentage as the weight of raw materials third-party certified to an environmental and/or social standard divided by the total weight of raw materials that compose the entity's finished products."", ""The percentage shall be calculated as the weight (in air-dried metric tons) of the entity's wood fiber materials purchased during the reporting period that have been sourced from forestlands certified to one or more of the third-party forest management standards divided by the total weight (in air-dried metric tons) of wood fiber materials purchased during the reporting period.""]","['9_b1', '22_b3']","['b1-apparel-accessories-and-footwear', 'b2-appliance-manufacturing', 'b3-building-products-and-furnishings']","These industries all involve consumer goods that have significant global supply chains, environmental impacts from manufacturing, and considerations around labor practices in emerging markets.",multi_hop
