qa_type,question,optionA,optionB,optionC,optionD,optionE,answer,explanation,references,pages,pairing_explanation,industries
Reporting Requirements,"When reporting on greenhouse gas emissions for Iron & Steel Producers and Industrial Machinery & Goods manufacturers, which of the following is a key difference in the required disclosures?",Only Iron & Steel Producers need to report Scope 1 emissions,"Industrial Machinery & Goods manufacturers must report Scope 3 emissions, while Iron & Steel Producers do not",Iron & Steel Producers must disclose the percentage of emissions covered under emissions-limiting regulations,Industrial Machinery & Goods manufacturers are required to report emissions from product use phase,Both industries have identical GHG reporting requirements,C: Iron & Steel Producers must disclose the percentage of emissions covered under emissions-limiting regulations,"According to the IFRS S2 standards, Iron & Steel Producers are required to disclose the percentage of their Scope 1 emissions that are covered under emissions-limiting regulations (EM-IS-110a.1). This specific requirement is not mentioned for Industrial Machinery & Goods manufacturers. While both industries need to report on emissions, this particular aspect is a key difference in their reporting requirements.","['IFRS S2 Climate-related Disclosures Appendix B Industry-based disclosure requirements: Iron & Steel Producers', 'IFRS S2 Climate-related Disclosures Appendix B Industry-based disclosure requirements: Industrial Machinery & Goods']","['72', '529']","These industries are interrelated as steel production feeds into machinery manufacturing, necessitating reviews of supply chain sustainability and emissions.","['b9-iron-and-steel-producers', 'b50-industrial-machinery-and-goods']"
Reporting Requirements,"In terms of energy management reporting, what is a key similarity between the Iron & Steel Producers and Industrial Machinery & Goods industries according to IFRS S2 standards?",Both industries must report on coal consumption percentage,"Both industries are required to disclose total energy consumed, percentage grid electricity, and percentage renewable",Both industries need to report on energy intensity per unit of production,Neither industry is required to report on energy management,Both industries must disclose energy efficiency improvements year-over-year,"B: Both industries are required to disclose total energy consumed, percentage grid electricity, and percentage renewable","According to the IFRS S2 standards, both Iron & Steel Producers (EM-IS-130a.1) and Industrial Machinery & Goods manufacturers (RT-IG-130a.1) are required to disclose (1) total energy consumed, (2) percentage grid electricity, and (3) percentage renewable. This is a key similarity in their energy management reporting requirements.","['IFRS S2 Climate-related Disclosures Appendix B Industry-based disclosure requirements: Iron & Steel Producers', 'IFRS S2 Climate-related Disclosures Appendix B Industry-based disclosure requirements: Industrial Machinery & Goods']","['75', '529']","These industries are interrelated as steel production feeds into machinery manufacturing, necessitating reviews of supply chain sustainability and emissions.","['b9-iron-and-steel-producers', 'b50-industrial-machinery-and-goods']"
Metric Selection and Calculation,"When calculating the percentage of renewable energy consumed for both Iron & Steel Producers and Industrial Machinery & Goods manufacturers, which of the following is considered within the scope of renewable energy according to IFRS S2 standards?",All biomass sources without certification,Grid electricity from unspecified sources,Renewable energy certificates (RECs) that have been sold,On-site generated renewable electricity with retained and retired RECs,Fossil fuel-based energy with carbon offsets,D: On-site generated renewable electricity with retained and retired RECs,"For both industries, IFRS S2 standards specify that for any renewable electricity generated on-site, the associated RECs and GOs must be retained (i.e., not sold) and retired or cancelled on behalf of the entity in order for it to be claimed as renewable energy. This ensures that the renewable attributes are not double-counted and accurately reflect the entity's renewable energy consumption.","['IFRS S2 Climate-related Disclosures Appendix B Industry-based disclosure requirements: Iron & Steel Producers', 'IFRS S2 Climate-related Disclosures Appendix B Industry-based disclosure requirements: Industrial Machinery & Goods']","['76', '530']","These industries are interrelated as steel production feeds into machinery manufacturing, necessitating reviews of supply chain sustainability and emissions.","['b9-iron-and-steel-producers', 'b50-industrial-machinery-and-goods']"
Metric Selection and Calculation,"In reporting fuel efficiency for Industrial Machinery & Goods manufacturers, which metric is used for stationary generators that is not applicable to Iron & Steel Producers?","Gallons per 1,000 ton-miles",Watts per gallon,Gigajoules per metric ton of production,Kilowatt-hours per unit produced,Liters per operating hour,B: Watts per gallon,"For Industrial Machinery & Goods manufacturers, IFRS S2 standards require reporting the sales-weighted fuel efficiency for stationary generators in watts per gallon (RT-IG-410a.3). This specific metric is not applicable to Iron & Steel Producers, as they do not typically manufacture stationary generators. This metric is unique to the Industrial Machinery & Goods industry and reflects the efficiency of power generation equipment they produce.",['IFRS S2 Climate-related Disclosures Appendix B Industry-based disclosure requirements: Industrial Machinery & Goods'],['532'],"These industries are interrelated as steel production feeds into machinery manufacturing, necessitating reviews of supply chain sustainability and emissions.","['b9-iron-and-steel-producers', 'b50-industrial-machinery-and-goods']"
Cross-Industry Comparison,How do the IFRS S2 standards for Iron & Steel Producers and Industrial Machinery & Goods manufacturers differ in their approach to addressing emissions in the value chain?,Only Iron & Steel Producers need to report on supply chain emissions,"Industrial Machinery & Goods manufacturers focus on product use-phase emissions, while Iron & Steel Producers focus on production emissions",Both industries have identical requirements for value chain emissions reporting,"Iron & Steel Producers report on Scope 3 emissions, while Industrial Machinery & Goods manufacturers do not",Neither industry is required to report on value chain emissions,"B: Industrial Machinery & Goods manufacturers focus on product use-phase emissions, while Iron & Steel Producers focus on production emissions","The IFRS S2 standards for these industries differ in their approach to value chain emissions. For Industrial Machinery & Goods manufacturers, there's a strong focus on product use-phase emissions, with requirements to report on fuel efficiency and emissions for various types of equipment they produce (RT-IG-410a.1 to RT-IG-410a.4). In contrast, Iron & Steel Producers' standards focus more on production-related emissions, including Scope 1 emissions and energy management in the production process (EM-IS-110a.1, EM-IS-130a.1). This difference reflects the distinct roles these industries play in the value chain, with machinery manufacturers being more concerned about the environmental impact of their products during use, while steel producers focus on the emissions from their production processes.","['IFRS S2 Climate-related Disclosures Appendix B Industry-based disclosure requirements: Iron & Steel Producers', 'IFRS S2 Climate-related Disclosures Appendix B Industry-based disclosure requirements: Industrial Machinery & Goods']","['71', '531']","These industries are interrelated as steel production feeds into machinery manufacturing, necessitating reviews of supply chain sustainability and emissions.","['b9-iron-and-steel-producers', 'b50-industrial-machinery-and-goods']"
Cross-Industry Comparison,"Comparing the Iron & Steel Producers and Industrial Machinery & Goods industries, which sustainability topic is more prominently addressed in the IFRS S2 standards for Industrial Machinery & Goods but not explicitly covered for Iron & Steel Producers?",Water management,Energy consumption,Greenhouse gas emissions,Fuel economy and emissions in use-phase,Supply chain management,D: Fuel economy and emissions in use-phase,"The IFRS S2 standards for Industrial Machinery & Goods manufacturers prominently address 'Fuel Economy & Emissions in Use-phase' as a key sustainability topic (RT-IG-410a.1 to RT-IG-410a.4). This topic includes detailed metrics for fuel efficiency and emissions of various types of equipment during their use. In contrast, this specific topic is not explicitly covered in the standards for Iron & Steel Producers. This difference reflects the nature of the products each industry produces, with machinery and equipment having significant environmental impacts during their use phase, while steel products' main environmental impact is during production.","['IFRS S2 Climate-related Disclosures Appendix B Industry-based disclosure requirements: Iron & Steel Producers', 'IFRS S2 Climate-related Disclosures Appendix B Industry-based disclosure requirements: Industrial Machinery & Goods']","['528', '531']","These industries are interrelated as steel production feeds into machinery manufacturing, necessitating reviews of supply chain sustainability and emissions.","['b9-iron-and-steel-producers', 'b50-industrial-machinery-and-goods']"
