qa_type,question,optionA,optionB,optionC,optionD,optionE,answer,explanation,references,pages,pairing_explanation,industries
Reporting Requirements,"When reporting on raw materials sourcing for the Apparel, Accessories & Footwear industry, which of the following is NOT a required disclosure according to IFRS standards?",Description of environmental risks associated with sourcing priority raw materials,Description of social risks associated with sourcing priority raw materials,Percentage of raw materials third-party certified to an environmental sustainability standard,Methodology for identifying priority raw materials,Total weight of raw materials used in production,E. Total weight of raw materials used in production,"According to the IFRS standards for the Apparel, Accessories & Footwear industry, companies are required to disclose environmental and social risks associated with sourcing priority raw materials, the percentage of raw materials third-party certified to sustainability standards, and the methodology for identifying priority raw materials. However, the total weight of raw materials used in production is not specifically required in these disclosures.","['IFRS S2 Climate-related Disclosures Appendix B Industry-based disclosure requirements: Apparel, Accessories & Footwear']","['8', '9', '10']","Manufacturing machinery for the apparel industry involves sustainability in production efficiency, energy use, and emissions control.","['b50-industrial-machinery-and-goods', 'b1-apparel-accessories-and-footwear']"
Reporting Requirements,"In the Industrial Machinery & Goods industry, which energy-related metric is required to be disclosed according to IFRS standards that is not explicitly required for the Apparel, Accessories & Footwear industry?",Total energy consumed,Percentage of grid electricity used,Percentage of renewable energy used,Energy intensity per unit of production,Scope 1 and Scope 2 greenhouse gas emissions,B. Percentage of grid electricity used,"The Industrial Machinery & Goods industry is specifically required to disclose the percentage of grid electricity used as part of its energy management reporting. This metric is not explicitly mentioned in the reporting requirements for the Apparel, Accessories & Footwear industry. Both industries are required to report on total energy consumed and percentage of renewable energy, but the grid electricity percentage is unique to the Industrial Machinery & Goods disclosures.","['IFRS S2 Climate-related Disclosures Appendix B Industry-based disclosure requirements: Industrial Machinery & Goods', 'IFRS S2 Climate-related Disclosures Appendix B Industry-based disclosure requirements: Apparel, Accessories & Footwear']","['529', '530']","Manufacturing machinery for the apparel industry involves sustainability in production efficiency, energy use, and emissions control.","['b50-industrial-machinery-and-goods', 'b1-apparel-accessories-and-footwear']"
Metric Selection and Calculation,"When calculating the percentage of raw materials third-party certified to an environmental and/or social sustainability standard in the Apparel, Accessories & Footwear industry, what is the correct denominator to use?",Total weight of all raw materials purchased,Total weight of priority raw materials,Total weight of raw materials that compose the entity's finished products,Total number of different raw materials used,Total cost of raw materials,C. Total weight of raw materials that compose the entity's finished products,"According to the IFRS standards for the Apparel, Accessories & Footwear industry, the percentage of certified raw materials should be calculated as the weight of raw materials third-party certified to an environmental and/or social standard divided by the total weight of raw materials that compose the entity's finished products. This ensures that the metric reflects the proportion of certified materials in the actual products, not just in purchases or priority materials.","['IFRS S2 Climate-related Disclosures Appendix B Industry-based disclosure requirements: Apparel, Accessories & Footwear']",['10'],"Manufacturing machinery for the apparel industry involves sustainability in production efficiency, energy use, and emissions control.","['b50-industrial-machinery-and-goods', 'b1-apparel-accessories-and-footwear']"
Metric Selection and Calculation,"In the Industrial Machinery & Goods industry, how is the sales-weighted fuel efficiency for non-road equipment calculated according to IFRS standards?",Total fuel consumed divided by total hours of operation,Average of model-rated fuel efficiency values,"Gallons of fuel consumed per 1,000 ton-miles","Gallons of fuel consumed per hour of operation, weighted by sales volume",Watts produced per gallon of fuel consumed,"D. Gallons of fuel consumed per hour of operation, weighted by sales volume","For the Industrial Machinery & Goods industry, IFRS standards require the calculation of sales-weighted fuel efficiency for non-road equipment as gallons of fuel consumed per hour of operation, weighted by the number of each unit sold during the reporting period. This metric provides a standardized way to compare fuel efficiency across different types of non-road equipment while accounting for sales volumes.",['IFRS S2 Climate-related Disclosures Appendix B Industry-based disclosure requirements: Industrial Machinery & Goods'],"['531', '532']","Manufacturing machinery for the apparel industry involves sustainability in production efficiency, energy use, and emissions control.","['b50-industrial-machinery-and-goods', 'b1-apparel-accessories-and-footwear']"
Cross-Industry Comparison,"How do the IFRS sustainability reporting requirements differ between the Apparel, Accessories & Footwear industry and the Industrial Machinery & Goods industry in terms of supply chain considerations?",Only the Apparel industry requires reporting on supplier environmental practices,"The Industrial Machinery industry focuses on Tier 1 suppliers, while Apparel considers multiple tiers","The Apparel industry requires disclosure of raw material sourcing risks, while Industrial Machinery does not","Industrial Machinery must report on supplier emissions, but Apparel does not",There are no significant differences in supply chain reporting requirements,"C. The Apparel industry requires disclosure of raw material sourcing risks, while Industrial Machinery does not","The Apparel, Accessories & Footwear industry has specific requirements to disclose environmental and social risks associated with sourcing priority raw materials, including the description of these risks and the percentage of materials certified to sustainability standards. In contrast, the Industrial Machinery & Goods industry standards focus more on the energy efficiency and emissions of the products themselves, without explicit requirements for raw material sourcing risks. This difference reflects the unique supply chain challenges and sustainability focus areas of each industry.","['IFRS S2 Climate-related Disclosures Appendix B Industry-based disclosure requirements: Apparel, Accessories & Footwear', 'IFRS S2 Climate-related Disclosures Appendix B Industry-based disclosure requirements: Industrial Machinery & Goods']","['8', '9', '10', '528', '529', '530']","Manufacturing machinery for the apparel industry involves sustainability in production efficiency, energy use, and emissions control.","['b50-industrial-machinery-and-goods', 'b1-apparel-accessories-and-footwear']"
Cross-Industry Comparison,"Which of the following metrics is most relevant for assessing product-use phase environmental impact in the Industrial Machinery & Goods industry but not typically applicable to the Apparel, Accessories & Footwear industry?",Percentage of recycled materials used in products,Water consumption during manufacturing,Sales-weighted emissions of nitrogen oxides (NOx) and particulate matter (PM),Energy efficiency of production facilities,Percentage of products with eco-friendly packaging,C. Sales-weighted emissions of nitrogen oxides (NOx) and particulate matter (PM),"The sales-weighted emissions of nitrogen oxides (NOx) and particulate matter (PM) is a key metric for the Industrial Machinery & Goods industry, particularly for engines and heavy equipment. This metric is crucial for assessing the environmental impact during the use phase of these products. In contrast, the Apparel, Accessories & Footwear industry typically doesn't have significant NOx or PM emissions during product use, making this metric less relevant. This difference highlights the distinct environmental considerations between machinery manufacturing and apparel production.","['IFRS S2 Climate-related Disclosures Appendix B Industry-based disclosure requirements: Industrial Machinery & Goods', 'IFRS S2 Climate-related Disclosures Appendix B Industry-based disclosure requirements: Apparel, Accessories & Footwear']","['532', '533']","Manufacturing machinery for the apparel industry involves sustainability in production efficiency, energy use, and emissions control.","['b50-industrial-machinery-and-goods', 'b1-apparel-accessories-and-footwear']"
