qa_type,question,optionA,optionB,optionC,optionD,optionE,answer,explanation,references,pages,pairing_explanation,industries
Reporting Requirements,"When reporting on the environmental footprint of hardware infrastructure for both Internet Media & Services and Software & IT Services industries, which of the following is NOT a required disclosure according to IFRS standards?",Total energy consumed,Percentage of energy from grid electricity,Percentage of energy from renewable sources,Total water withdrawn,Carbon emissions per unit of data processed,E. Carbon emissions per unit of data processed,"Both industries are required to disclose total energy consumed, percentage of energy from grid electricity, percentage of energy from renewable sources, and total water withdrawn. Carbon emissions per unit of data processed is not explicitly mentioned as a required disclosure in the IFRS standards for either industry.","['IFRS S2 Climate-related Disclosures Appendix B Industry-based disclosure requirements: Internet Media & Services', 'IFRS S2 Climate-related Disclosures Appendix B Industry-based disclosure requirements: Software & IT Services']","['560', '578']",Both industries heavily rely on data centers and digital infrastructures that consume significant energy. Their approaches to energy efficiency and carbon footprint management are critical for sustainable development in the tech sector.,"['b58-software-and-it-services', 'b56-internet-media-and-services']"
Reporting Requirements,"According to IFRS standards, which of the following is a required component of the discussion on integrating environmental considerations into strategic planning for data center needs for both Internet Media & Services and Software & IT Services industries?",Detailed cost analysis of energy-efficient technologies,Comparison of data center performance against industry benchmarks,"Impact of environmental factors on decisions regarding siting, design, construction, refurbishment, and operations of data centers",Projected energy savings from future data center upgrades,Analysis of competitor's data center environmental strategies,"C. Impact of environmental factors on decisions regarding siting, design, construction, refurbishment, and operations of data centers","Both industries are required to discuss how environmental factors impact the entity's decisions regarding the siting, design, construction, refurbishment, and operations of data centers. This includes consideration of location-based environmental factors and environmental regulations.","['IFRS S2 Climate-related Disclosures Appendix B Industry-based disclosure requirements: Internet Media & Services', 'IFRS S2 Climate-related Disclosures Appendix B Industry-based disclosure requirements: Software & IT Services']","['563', '581']",Both industries heavily rely on data centers and digital infrastructures that consume significant energy. Their approaches to energy efficiency and carbon footprint management are critical for sustainable development in the tech sector.,"['b58-software-and-it-services', 'b56-internet-media-and-services']"
Metric Selection and Calculation,"When calculating the percentage of renewable energy consumed for both Internet Media & Services and Software & IT Services industries, which of the following sources should NOT be included according to IFRS standards?",Renewable fuel consumed by the entity,Renewable energy directly produced by the entity,Renewable energy purchased through a power purchase agreement (PPA) with explicit RECs,Renewable portion of the electricity grid mix outside the entity's control,Green-e Energy Certified utility program purchases,D. Renewable portion of the electricity grid mix outside the entity's control,"According to the IFRS standards for both industries, the renewable portion of the electricity grid mix that is outside of the control or influence of the entity is explicitly excluded from the scope of renewable energy calculation.","['IFRS S2 Climate-related Disclosures Appendix B Industry-based disclosure requirements: Internet Media & Services', 'IFRS S2 Climate-related Disclosures Appendix B Industry-based disclosure requirements: Software & IT Services']","['561-562', '579-580']",Both industries heavily rely on data centers and digital infrastructures that consume significant energy. Their approaches to energy efficiency and carbon footprint management are critical for sustainable development in the tech sector.,"['b58-software-and-it-services', 'b56-internet-media-and-services']"
Metric Selection and Calculation,"When reporting on water consumption for both Internet Media & Services and Software & IT Services industries, which of the following is NOT considered as water consumption according to IFRS standards?","Water that evaporates during withdrawal, usage, and discharge",Water that is directly incorporated into the entity's product or service,Water that is indirectly incorporated into the entity's product or service,Water that returns to the same catchment area from which it was withdrawn,Water that is returned to another catchment area or the sea,D. Water that returns to the same catchment area from which it was withdrawn,"According to IFRS standards for both industries, water consumption is defined as water that evaporates, is incorporated into products/services, or does not return to the same catchment area. Water that returns to the same catchment area from which it was withdrawn is not considered as consumed.","['IFRS S2 Climate-related Disclosures Appendix B Industry-based disclosure requirements: Internet Media & Services', 'IFRS S2 Climate-related Disclosures Appendix B Industry-based disclosure requirements: Software & IT Services']","['562-563', '580-581']",Both industries heavily rely on data centers and digital infrastructures that consume significant energy. Their approaches to energy efficiency and carbon footprint management are critical for sustainable development in the tech sector.,"['b58-software-and-it-services', 'b56-internet-media-and-services']"
Cross-Industry Comparison,"When comparing the Internet Media & Services industry with the Software & IT Services industry in terms of sustainability reporting, which of the following statements is correct?",Only the Internet Media & Services industry is required to report on water stress,The Software & IT Services industry has additional requirements for reporting on systemic risks from technology disruptions,The Internet Media & Services industry has more detailed requirements for reporting on renewable energy sources,Only the Software & IT Services industry is required to discuss environmental considerations in data center planning,The two industries have identical reporting requirements for environmental footprint of hardware infrastructure,B. The Software & IT Services industry has additional requirements for reporting on systemic risks from technology disruptions,"While both industries have similar requirements for reporting on environmental footprint of hardware infrastructure, the Software & IT Services industry has additional metrics and discussion requirements related to managing systemic risks from technology disruptions, including performance issues, service disruptions, and business continuity risks.","['IFRS S2 Climate-related Disclosures Appendix B Industry-based disclosure requirements: Internet Media & Services', 'IFRS S2 Climate-related Disclosures Appendix B Industry-based disclosure requirements: Software & IT Services']","['559-563', '576-583']",Both industries heavily rely on data centers and digital infrastructures that consume significant energy. Their approaches to energy efficiency and carbon footprint management are critical for sustainable development in the tech sector.,"['b58-software-and-it-services', 'b56-internet-media-and-services']"
Cross-Industry Comparison,How do the activity metrics differ between the Internet Media & Services industry and the Software & IT Services industry in IFRS sustainability reporting?,"Internet Media & Services reports on user activity, while Software & IT Services reports on licenses/subscriptions","Software & IT Services reports on data processing capacity, while Internet Media & Services does not","Internet Media & Services reports on amount of data storage, while Software & IT Services does not","Software & IT Services reports on cloud-based percentages, while Internet Media & Services does not",The activity metrics are identical for both industries,"A. Internet Media & Services reports on user activity, while Software & IT Services reports on licenses/subscriptions","The main difference in activity metrics is that Internet Media & Services reports on an entity-defined measure of user activity, while Software & IT Services reports on the number of licenses or subscriptions and the percentage that are cloud-based. Both industries report on data processing capacity and amount of data storage.","['IFRS S2 Climate-related Disclosures Appendix B Industry-based disclosure requirements: Internet Media & Services', 'IFRS S2 Climate-related Disclosures Appendix B Industry-based disclosure requirements: Software & IT Services']","['559', '576']",Both industries heavily rely on data centers and digital infrastructures that consume significant energy. Their approaches to energy efficiency and carbon footprint management are critical for sustainable development in the tech sector.,"['b58-software-and-it-services', 'b56-internet-media-and-services']"
