qa_type,question,optionA,optionB,optionC,optionD,optionE,answer,explanation,references,pages,pairing_explanation,industries
Reporting Requirements,"In sustainability reporting for restaurants and automobile manufacturers, which of the following is a common required disclosure for both industries according to IFRS standards?",Sales-weighted average passenger fleet fuel economy,Percentage of food purchased that meets environmental and social sourcing standards,Total energy consumed,Number of zero emission vehicles sold,Percentage of eggs from cage-free environments,C: Total energy consumed,Both the restaurant industry (FB-RN-130a.1) and automobile industry (as part of their overall sustainability reporting) are required to disclose total energy consumed. This metric is crucial for understanding the energy management and efficiency efforts of companies in both sectors.,"['IFRS S2 Climate-related Disclosures Appendix B Industry-based disclosure requirements: Restaurants', 'IFRS S2 Climate-related Disclosures Appendix B Industry-based disclosure requirements: Automobiles']","['271', '610']","Both industries are highly visible consumer-facing sectors where sustainability reporting on emissions, waste, and resource use is increasingly scrutinized.","['b26-restaurants', 'b63-automobiles']"
Reporting Requirements,"When reporting on water management, which of the following disclosures is specifically required for restaurants but not explicitly mentioned for automobile manufacturers in the IFRS standards?",Total water withdrawn,Percentage of water consumed in regions with High or Extremely High Baseline Water Stress,Water recycling rate,Annual reduction in water consumption,Water quality metrics,B: Percentage of water consumed in regions with High or Extremely High Baseline Water Stress,"The restaurant industry is specifically required to disclose the percentage of water consumed in regions with High or Extremely High Baseline Water Stress (FB-RN-140a.1). This requirement is not explicitly mentioned for automobile manufacturers in the provided IFRS standards, reflecting the different water-related risks and impacts of these industries.","['IFRS S2 Climate-related Disclosures Appendix B Industry-based disclosure requirements: Restaurants', 'IFRS S2 Climate-related Disclosures Appendix B Industry-based disclosure requirements: Automobiles']","['273-274', '609-613']","Both industries are highly visible consumer-facing sectors where sustainability reporting on emissions, waste, and resource use is increasingly scrutinized.","['b26-restaurants', 'b63-automobiles']"
Metric Selection and Calculation,"When calculating and reporting fuel economy metrics, what is a key difference between the restaurant and automobile industries?","Restaurants report fuel economy in miles per gallon, while automobile manufacturers use liters per kilometer","Automobile manufacturers report sales-weighted average fleet fuel economy, while restaurants do not report fuel economy","Restaurants calculate fuel economy based on delivery vehicles, while automobile manufacturers focus on passenger vehicles","Automobile manufacturers report fuel economy by vehicle type, while restaurants report it by kitchen appliance","Restaurants report fuel economy improvements annually, while automobile manufacturers report it by model year","B: Automobile manufacturers report sales-weighted average fleet fuel economy, while restaurants do not report fuel economy","Automobile manufacturers are required to report sales-weighted average passenger fleet fuel economy (TR-AU-410a.1), which is a crucial metric for their industry. Restaurants, on the other hand, do not have specific fuel economy reporting requirements in their IFRS standards, as their operations typically don't involve a fleet of vehicles.","['IFRS S2 Climate-related Disclosures Appendix B Industry-based disclosure requirements: Restaurants', 'IFRS S2 Climate-related Disclosures Appendix B Industry-based disclosure requirements: Automobiles']","['271-272', '610-611']","Both industries are highly visible consumer-facing sectors where sustainability reporting on emissions, waste, and resource use is increasingly scrutinized.","['b26-restaurants', 'b63-automobiles']"
Metric Selection and Calculation,"When reporting on energy consumption, what calculation method is common to both the restaurant and automobile industries according to IFRS standards?",Energy consumption per customer served,Energy consumption per vehicle produced,Percentage of renewable energy used,Energy intensity per square foot of facility space,Total energy consumed from all sources in gigajoules (GJ),E: Total energy consumed from all sources in gigajoules (GJ),Both industries are required to report total energy consumed from all sources in gigajoules (GJ). This is explicitly stated for restaurants (FB-RN-130a.1) and is a standard sustainability reporting metric that would also apply to automobile manufacturers. This common metric allows for comparison of energy consumption across different industries and company sizes.,"['IFRS S2 Climate-related Disclosures Appendix B Industry-based disclosure requirements: Restaurants', 'IFRS S2 Climate-related Disclosures Appendix B Industry-based disclosure requirements: Automobiles']","['271-272', '609-613']","Both industries are highly visible consumer-facing sectors where sustainability reporting on emissions, waste, and resource use is increasingly scrutinized.","['b26-restaurants', 'b63-automobiles']"
Cross-Industry Comparison,How do the IFRS sustainability reporting requirements differ between restaurants and automobile manufacturers in terms of addressing product lifecycle emissions?,"Restaurants focus on sourcing emissions, while automobile manufacturers focus on use-phase emissions","Automobile manufacturers report on production emissions, while restaurants report on waste emissions","Restaurants report on cooking emissions, while automobile manufacturers report on recycling emissions",Both industries equally focus on end-of-life product emissions,Neither industry is required to report on product lifecycle emissions,"A: Restaurants focus on sourcing emissions, while automobile manufacturers focus on use-phase emissions","The IFRS standards for restaurants emphasize reporting on supply chain management and food sourcing (FB-RN-430a.1, FB-RN-430a.2, FB-RN-430a.3), which relates to sourcing emissions. For automobile manufacturers, there's a strong focus on use-phase emissions through fuel economy and emissions metrics (TR-AU-410a.1, TR-AU-410a.2, TR-AU-410a.3). This difference reflects the distinct environmental impacts and challenges of each industry.","['IFRS S2 Climate-related Disclosures Appendix B Industry-based disclosure requirements: Restaurants', 'IFRS S2 Climate-related Disclosures Appendix B Industry-based disclosure requirements: Automobiles']","['275-278', '610-613']","Both industries are highly visible consumer-facing sectors where sustainability reporting on emissions, waste, and resource use is increasingly scrutinized.","['b26-restaurants', 'b63-automobiles']"
Cross-Industry Comparison,"When comparing sustainability reporting for restaurants and automobile manufacturers, which of the following themes is most prominently addressed in both industries' IFRS standards?",Animal welfare,Energy management,Labor practices,Biodiversity impact,Customer safety,B: Energy management,"Energy management is a prominent theme in the IFRS standards for both industries. For restaurants, there are specific metrics related to energy consumption and renewable energy use (FB-RN-130a.1). For automobile manufacturers, energy management is implicit in the focus on fuel economy and emissions (TR-AU-410a.1, TR-AU-410a.2, TR-AU-410a.3). Both industries are required to report on their energy consumption and strategies to improve energy efficiency, reflecting the importance of energy management in sustainability efforts across different sectors.","['IFRS S2 Climate-related Disclosures Appendix B Industry-based disclosure requirements: Restaurants', 'IFRS S2 Climate-related Disclosures Appendix B Industry-based disclosure requirements: Automobiles']","['271-272', '610-613']","Both industries are highly visible consumer-facing sectors where sustainability reporting on emissions, waste, and resource use is increasingly scrutinized.","['b26-restaurants', 'b63-automobiles']"
