qa_type,question,optionA,optionB,optionC,optionD,optionE,answer,explanation,references,pages,pairing_explanation,industries
Reporting Requirements,"When reporting on energy consumption for both Drug Retailers and Building Products & Furnishings industries, which of the following is NOT a required disclosure according to IFRS standards?",Total energy consumed,Percentage of grid electricity,Percentage of renewable energy,Energy intensity per square meter of retail/manufacturing space,Higher heating values (HHV) for fuel usage calculations,D. Energy intensity per square meter of retail/manufacturing space,"Both industries are required to disclose total energy consumed, percentage of grid electricity, and percentage of renewable energy. They also must use higher heating values (HHV) for fuel usage calculations. However, energy intensity per square meter is not explicitly required in the IFRS standards for these industries.","['IFRS S2 Climate-related Disclosures Appendix B Industry-based disclosure requirements: Building Products & Furnishings', 'IFRS S2 Climate-related Disclosures Appendix B Industry-based disclosure requirements: Drug Retailers']","['16-17', '280-281']",Drug retailers and building products both require extensive supply chain management and sustainability practices in sourcing and manufacturing.,"['b27-drug-retailers', 'b3-building-products-and-furnishings']"
Reporting Requirements,"In the context of renewable energy reporting for Drug Retailers and Building Products & Furnishings, what is a key requirement for claiming on-site generated renewable electricity according to IFRS standards?",The energy must be sold to the grid,The energy must be used within 24 hours of generation,Renewable Energy Certificates (RECs) must be retained and retired on behalf of the entity,The energy must come from solar sources only,The energy must be reported separately from purchased renewable energy,C. Renewable Energy Certificates (RECs) must be retained and retired on behalf of the entity,"For both industries, IFRS standards specify that for any renewable electricity generated on-site, any RECs and Guarantees of Origin (GOs) must be retained (i.e., not sold) and retired or cancelled on behalf of the entity in order for the entity to claim them as renewable energy.","['IFRS S2 Climate-related Disclosures Appendix B Industry-based disclosure requirements: Building Products & Furnishings', 'IFRS S2 Climate-related Disclosures Appendix B Industry-based disclosure requirements: Drug Retailers']","['17', '281']",Drug retailers and building products both require extensive supply chain management and sustainability practices in sourcing and manufacturing.,"['b27-drug-retailers', 'b3-building-products-and-furnishings']"
Metric Selection and Calculation,"When calculating the percentage of renewable energy consumed for both Drug Retailers and Building Products & Furnishings, which of the following is NOT included in the scope of renewable energy according to IFRS standards?",Renewable fuel consumed by the entity,Renewable energy directly produced by the entity,Renewable energy purchased through a PPA with explicit RECs,The renewable portion of the electricity grid mix outside the entity's control,Green-e Energy Certified utility program purchases,D. The renewable portion of the electricity grid mix outside the entity's control,"For both industries, IFRS standards explicitly exclude the renewable portion of the electricity grid mix that is outside of the control or influence of the entity from the scope of renewable energy calculations. All other options listed are included in the scope of renewable energy for percentage calculations.","['IFRS S2 Climate-related Disclosures Appendix B Industry-based disclosure requirements: Building Products & Furnishings', 'IFRS S2 Climate-related Disclosures Appendix B Industry-based disclosure requirements: Drug Retailers']","['17', '280-281']",Drug retailers and building products both require extensive supply chain management and sustainability practices in sourcing and manufacturing.,"['b27-drug-retailers', 'b3-building-products-and-furnishings']"
Metric Selection and Calculation,"In reporting energy consumption for Drug Retailers and Building Products & Furnishings, what unit of measure is required for disclosing total energy consumed according to IFRS standards?",Kilowatt-hours (kWh),Megawatt-hours (MWh),British Thermal Units (BTU),Gigajoules (GJ),Therms,D. Gigajoules (GJ),"For both Drug Retailers and Building Products & Furnishings industries, IFRS standards require that the total amount of energy consumed be disclosed as an aggregate figure in gigajoules (GJ).","['IFRS S2 Climate-related Disclosures Appendix B Industry-based disclosure requirements: Building Products & Furnishings', 'IFRS S2 Climate-related Disclosures Appendix B Industry-based disclosure requirements: Drug Retailers']","['16', '280']",Drug retailers and building products both require extensive supply chain management and sustainability practices in sourcing and manufacturing.,"['b27-drug-retailers', 'b3-building-products-and-furnishings']"
Cross-Industry Comparison,How does the scope of sustainability reporting for energy management differ between Drug Retailers and Building Products & Furnishings industries?,"Drug Retailers focus on retail space, while Building Products & Furnishings include manufacturing facilities","Drug Retailers report on prescription energy use, while Building Products & Furnishings report on product lifecycle energy","Drug Retailers include pharmacy-specific energy metrics, while Building Products & Furnishings do not have industry-specific energy metrics","Building Products & Furnishings report on renewable energy, while Drug Retailers do not",There is no significant difference in energy management reporting between the two industries,"A. Drug Retailers focus on retail space, while Building Products & Furnishings include manufacturing facilities","The main difference in energy management reporting between these industries is the scope of operations covered. Drug Retailers primarily focus on energy consumption in retail spaces, as evidenced by their activity metric of 'Total area of retail space'. In contrast, Building Products & Furnishings industry includes energy consumption in manufacturing facilities, with an activity metric of 'Area of manufacturing facilities'.","['IFRS S2 Climate-related Disclosures Appendix B Industry-based disclosure requirements: Building Products & Furnishings', 'IFRS S2 Climate-related Disclosures Appendix B Industry-based disclosure requirements: Drug Retailers']","['15', '279']",Drug retailers and building products both require extensive supply chain management and sustainability practices in sourcing and manufacturing.,"['b27-drug-retailers', 'b3-building-products-and-furnishings']"
Cross-Industry Comparison,"What unique sustainability reporting consideration does the Building Products & Furnishings industry have compared to Drug Retailers, as per IFRS standards?",Reporting on customer medication adherence,Disclosing the number of pharmacists employed,Reporting on wood fiber materials and forestry management,Disclosing the number of prescriptions filled,Reporting on controlled substance management,C. Reporting on wood fiber materials and forestry management,"The Building Products & Furnishings industry has unique reporting requirements related to wood supply chain management, including disclosures on the total weight of wood fiber materials purchased and the percentage from certified forestlands. This consideration is specific to this industry and not applicable to Drug Retailers.","['IFRS S2 Climate-related Disclosures Appendix B Industry-based disclosure requirements: Building Products & Furnishings', 'IFRS S2 Climate-related Disclosures Appendix B Industry-based disclosure requirements: Drug Retailers']","['22-24', '279-281']",Drug retailers and building products both require extensive supply chain management and sustainability practices in sourcing and manufacturing.,"['b27-drug-retailers', 'b3-building-products-and-furnishings']"
