qa_type,question,optionA,optionB,optionC,optionD,optionE,answer,explanation,references,pages,pairing_explanation,industries
Reporting Requirements,"How do the IFRS reporting requirements for greenhouse gas emissions differ between the Agricultural Products and Meat, Poultry & Dairy industries?","Agricultural Products must report Scope 1, 2, and 3 emissions, while Meat, Poultry & Dairy only report Scope 1","Meat, Poultry & Dairy must include emissions from livestock, while Agricultural Products do not","Agricultural Products must report fleet fuel consumption, while Meat, Poultry & Dairy do not have this requirement","Meat, Poultry & Dairy must report emissions reduction targets, while Agricultural Products do not",There are no significant differences in GHG emissions reporting requirements between the two industries,"C. Agricultural Products must report fleet fuel consumption, while Meat, Poultry & Dairy do not have this requirement","The Agricultural Products industry has a specific metric (FB-AG-110a.3) requiring disclosure of fleet fuel consumed and percentage renewable, which is not present in the Meat, Poultry & Dairy industry requirements. Both industries must report Scope 1 emissions and discuss strategies to manage them, but the fleet fuel requirement is unique to Agricultural Products.","['IFRS S2 Climate-related Disclosures Appendix B Industry-based disclosure requirements: Agricultural Products', 'IFRS S2 Climate-related Disclosures Appendix B Industry-based disclosure requirements: Meat, Poultry & Dairy']","['190', '191', '230', '231']","These food-related industries have extensive supply chains, substantial land and water use, and issues related to animal welfare, making their comparison important for sustainability reporting.","['b20-agricultural-products', 'b23-meat-poultry-and-dairy', 'b25-processed-foods']"
Reporting Requirements,What is a key difference in water management reporting requirements between the Processed Foods industry and the Agricultural Products industry?,"Processed Foods must report water consumption, while Agricultural Products only report water withdrawal","Agricultural Products must describe water management risks, while Processed Foods does not have this requirement","Processed Foods must report incidents of non-compliance with water regulations, while Agricultural Products does not","Agricultural Products must report percentage of water from regions with water stress, while Processed Foods does not","Processed Foods must report strategies to reduce water consumption, while Agricultural Products does not","B. Agricultural Products must describe water management risks, while Processed Foods does not have this requirement","The Agricultural Products industry has a specific metric (FB-AG-140a.2) requiring a description of water management risks and discussion of strategies and practices to mitigate those risks. While the Processed Foods industry has similar water-related metrics, it does not explicitly require a description of water management risks in the same manner.","['IFRS S2 Climate-related Disclosures Appendix B Industry-based disclosure requirements: Agricultural Products', 'IFRS S2 Climate-related Disclosures Appendix B Industry-based disclosure requirements: Processed Foods']","['196', '197', '198', '199', '261', '262', '263', '264']","These food-related industries have extensive supply chains, substantial land and water use, and issues related to animal welfare, making their comparison important for sustainability reporting.","['b20-agricultural-products', 'b23-meat-poultry-and-dairy', 'b25-processed-foods']"
Metric Selection and Calculation,How does the calculation of the percentage of agricultural products sourced from water-stressed regions differ between the Agricultural Products and Processed Foods industries?,"Agricultural Products uses volume, while Processed Foods uses cost","Agricultural Products includes all suppliers, while Processed Foods only includes Tier 1 suppliers","Processed Foods uses the WRI Aqueduct tool, while Agricultural Products uses a different water stress assessment method","Agricultural Products calculates based on land area, while Processed Foods uses product weight",There is no significant difference in the calculation method between the two industries,"A. Agricultural Products uses volume, while Processed Foods uses cost","For Agricultural Products, metric FB-AG-440a.2 requires calculating the percentage based on cost of agricultural products sourced from water-stressed regions. In contrast, for Processed Foods, metric FB-PF-440a.1 specifies calculating the percentage based on the cost of food ingredients sourced from such regions. This difference in calculation basis (volume vs. cost) is significant for companies preparing their sustainability reports.","['IFRS S2 Climate-related Disclosures Appendix B Industry-based disclosure requirements: Agricultural Products', 'IFRS S2 Climate-related Disclosures Appendix B Industry-based disclosure requirements: Processed Foods']","['201', '202', '268', '269']","These food-related industries have extensive supply chains, substantial land and water use, and issues related to animal welfare, making their comparison important for sustainability reporting.","['b20-agricultural-products', 'b23-meat-poultry-and-dairy', 'b25-processed-foods']"
Metric Selection and Calculation,"What is a key difference in how the Meat, Poultry & Dairy and Processed Foods industries are required to report on their supply chain environmental and social impacts?","Meat, Poultry & Dairy must report on animal welfare, while Processed Foods does not","Processed Foods must disclose the percentage of ingredients certified to third-party standards, while Meat, Poultry & Dairy does not","Meat, Poultry & Dairy must report on land use impacts, while Processed Foods does not","Processed Foods must report supplier audit non-conformance rates, while Meat, Poultry & Dairy does not","Meat, Poultry & Dairy must report on feed sourcing, while Processed Foods does not","B. Processed Foods must disclose the percentage of ingredients certified to third-party standards, while Meat, Poultry & Dairy does not","The Processed Foods industry has a specific metric (FB-PF-430a.1) requiring disclosure of the percentage of food ingredients sourced that are certified to third-party environmental and/or social standards. This requirement is not present in the Meat, Poultry & Dairy industry standards, which focus more on animal feed sourcing and land use impacts.","['IFRS S2 Climate-related Disclosures Appendix B Industry-based disclosure requirements: Meat, Poultry & Dairy', 'IFRS S2 Climate-related Disclosures Appendix B Industry-based disclosure requirements: Processed Foods']","['241', '242', '265', '266', '267']","These food-related industries have extensive supply chains, substantial land and water use, and issues related to animal welfare, making their comparison important for sustainability reporting.","['b20-agricultural-products', 'b23-meat-poultry-and-dairy', 'b25-processed-foods']"
Cross-Industry Comparison,"How do the climate change-related risks and opportunities differ in reporting requirements between the Agricultural Products and Meat, Poultry & Dairy industries?","Agricultural Products must focus on crop yields, while Meat, Poultry & Dairy must focus on animal health","Meat, Poultry & Dairy must report on feed sourcing risks, while Agricultural Products does not have this requirement","Agricultural Products must discuss impacts on specific crops, while Meat, Poultry & Dairy discusses impacts on overall production","Meat, Poultry & Dairy must report on emissions from animal digestion, while Agricultural Products does not",There are no significant differences in climate change risk reporting between the two industries,"B. Meat, Poultry & Dairy must report on feed sourcing risks, while Agricultural Products does not have this requirement","The Meat, Poultry & Dairy industry has a specific metric (FB-MP-440a.3) requiring discussion of strategy to manage opportunities and risks to feed sourcing and livestock supply presented by climate change. This requirement is unique to this industry and not present in the Agricultural Products industry standards, which focus more on risks to crop production.","['IFRS S2 Climate-related Disclosures Appendix B Industry-based disclosure requirements: Agricultural Products', 'IFRS S2 Climate-related Disclosures Appendix B Industry-based disclosure requirements: Meat, Poultry & Dairy']","['200', '201', '242', '243']","These food-related industries have extensive supply chains, substantial land and water use, and issues related to animal welfare, making their comparison important for sustainability reporting.","['b20-agricultural-products', 'b23-meat-poultry-and-dairy', 'b25-processed-foods']"
Cross-Industry Comparison,What is a key difference in how the Agricultural Products and Processed Foods industries are required to report on their ingredient sourcing risks?,"Agricultural Products must report on pesticide use, while Processed Foods does not","Processed Foods must identify priority ingredients, while Agricultural Products must identify principal crops","Agricultural Products must discuss climate change impacts on crops, while Processed Foods only discusses general supply chain risks","Processed Foods must report on food safety risks, while Agricultural Products does not",There are no significant differences in ingredient sourcing risk reporting between the two industries,"B. Processed Foods must identify priority ingredients, while Agricultural Products must identify principal crops","The Processed Foods industry has a specific metric (FB-PF-440a.2) requiring the identification of priority food ingredients and discussion of sourcing risks due to environmental and social considerations. In contrast, the Agricultural Products industry metric (FB-AG-440a.1) requires the identification of principal crops and description of risks and opportunities presented by climate change. This difference in focus (priority ingredients vs. principal crops) is significant for companies preparing their sustainability reports.","['IFRS S2 Climate-related Disclosures Appendix B Industry-based disclosure requirements: Agricultural Products', 'IFRS S2 Climate-related Disclosures Appendix B Industry-based disclosure requirements: Processed Foods']","['200', '201', '268', '269']","These food-related industries have extensive supply chains, substantial land and water use, and issues related to animal welfare, making their comparison important for sustainability reporting.","['b20-agricultural-products', 'b23-meat-poultry-and-dairy', 'b25-processed-foods']"
