qa_type,question,optionA,optionB,optionC,optionD,optionE,answer,explanation,references,pages,pairing_explanation,industries
Reporting Requirements,"When disclosing greenhouse gas (GHG) emissions, what is a key difference in reporting requirements between the Forestry Management and Chemicals industries?","Forestry Management must report Scope 1 and 2 emissions, while Chemicals only reports Scope 1","Chemicals must report the percentage of emissions covered under emissions-limiting regulations, while Forestry Management does not","Forestry Management reports emissions in CO2 equivalent, while Chemicals reports individual gases separately","Chemicals must provide emissions reduction targets, while Forestry Management does not","Forestry Management must report emissions from land use change, while Chemicals does not","B: Chemicals must report the percentage of emissions covered under emissions-limiting regulations, while Forestry Management does not","According to the IFRS standards, the Chemicals industry (RT-CH-110a.1) must disclose the percentage of Scope 1 emissions covered under emissions-limiting regulations. This requirement is not present for the Forestry Management industry, which focuses more on describing strategies to manage climate change risks and opportunities (RR-FM-450a.1).","['IFRS S2 Climate-related Disclosures Appendix B Industry-based disclosure requirements: Chemicals', 'IFRS S2 Climate-related Disclosures Appendix B Industry-based disclosure requirements: Forestry Management']","['494', '444-446']",Sustainable management of forestry products links directly to the chemicals industry’s need for renewable and environmentally-friendly feedstocks.,"['b41-forestry-management', 'b47-chemicals']"
Reporting Requirements,"In terms of water management disclosure, what is a key difference between the reporting requirements for the Forestry Management and Chemicals industries?","Forestry Management must report total water withdrawn, while Chemicals does not","Chemicals must report water consumption in water-stressed areas, while Forestry Management does not","Forestry Management must report incidents of non-compliance with water regulations, while Chemicals does not","Chemicals must report strategies to mitigate water risks, while Forestry Management does not","Forestry Management must report water quality metrics, while Chemicals only reports quantity","B: Chemicals must report water consumption in water-stressed areas, while Forestry Management does not","The Chemicals industry (RT-CH-140a.1) is required to disclose the percentage of water withdrawn and consumed in regions with High or Extremely High Baseline Water Stress. This specific requirement is not present for the Forestry Management industry, which focuses more on forest ecosystem services and impacts (RR-FM-160a.2, RR-FM-160a.3).","['IFRS S2 Climate-related Disclosures Appendix B Industry-based disclosure requirements: Chemicals', 'IFRS S2 Climate-related Disclosures Appendix B Industry-based disclosure requirements: Forestry Management']","['500-501', '441-443']",Sustainable management of forestry products links directly to the chemicals industry’s need for renewable and environmentally-friendly feedstocks.,"['b41-forestry-management', 'b47-chemicals']"
Metric Selection and Calculation,"When calculating the area of forestland with protected conservation status (RR-FM-160a.2) and the percentage of water consumed in water-stressed areas (RT-CH-140a.1), what common tool or database is referenced in both metrics?",Global Reporting Initiative (GRI) Standards,CDP Water Security Questionnaire,World Database on Protected Areas (WDPA),"World Resources Institute's (WRI) Water Risk Atlas tool, Aqueduct",United Nations Global Compact CEO Water Mandate,"D: World Resources Institute's (WRI) Water Risk Atlas tool, Aqueduct","Both metrics reference the WRI's Water Risk Atlas tool, Aqueduct. For Forestry Management, it's mentioned in relation to identifying protected areas (RR-FM-160a.2). For Chemicals, it's used to identify areas with High or Extremely High Baseline Water Stress (RT-CH-140a.1).","['IFRS S2 Climate-related Disclosures Appendix B Industry-based disclosure requirements: Chemicals', 'IFRS S2 Climate-related Disclosures Appendix B Industry-based disclosure requirements: Forestry Management']","['441', '501']",Sustainable management of forestry products links directly to the chemicals industry’s need for renewable and environmentally-friendly feedstocks.,"['b41-forestry-management', 'b47-chemicals']"
Metric Selection and Calculation,"When calculating energy consumption for the Chemicals industry (RT-CH-130a.1) and timber harvest volume for the Forestry Management industry (RR-FM-000.C), what similar requirement is specified for both metrics?",Both must be reported in metric tons,Both must disclose the calculation methodology used,Both must be reported as a percentage of total production,Both must disclose any conversion factors used if alternative units of measure are employed,Both must be externally verified by a third party,D: Both must disclose any conversion factors used if alternative units of measure are employed,"For the Chemicals industry, the entity must apply conversion factors consistently and disclose them (RT-CH-130a.1). Similarly, for Forestry Management, if other units of measure are used for timber harvest volume, the entity shall disclose any conversion factors used (Note to RR-FM-000.C).","['IFRS S2 Climate-related Disclosures Appendix B Industry-based disclosure requirements: Chemicals', 'IFRS S2 Climate-related Disclosures Appendix B Industry-based disclosure requirements: Forestry Management']","['498', '437']",Sustainable management of forestry products links directly to the chemicals industry’s need for renewable and environmentally-friendly feedstocks.,"['b41-forestry-management', 'b47-chemicals']"
Cross-Industry Comparison,How do the IFRS sustainability reporting standards for the Forestry Management and Chemicals industries differ in their approach to biodiversity and ecosystem impacts?,"Forestry Management focuses on land area metrics, while Chemicals focuses on emissions impacts","Chemicals requires reporting on biodiversity impacts, while Forestry Management does not","Forestry Management emphasizes ecosystem services, while Chemicals emphasizes product lifecycle impacts","Chemicals focuses on water ecosystem impacts, while Forestry Management ignores water-related metrics",Both industries have identical requirements for reporting on biodiversity and ecosystem impacts,"C: Forestry Management emphasizes ecosystem services, while Chemicals emphasizes product lifecycle impacts","The Forestry Management industry standards include detailed metrics on ecosystem services and impacts (RR-FM-160a.1 to RR-FM-160a.4), including areas of protected conservation status and endangered species habitat. In contrast, the Chemicals industry standards focus more on product lifecycle impacts, such as designing products for use-phase resource efficiency (RT-CH-410a.1).","['IFRS S2 Climate-related Disclosures Appendix B Industry-based disclosure requirements: Chemicals', 'IFRS S2 Climate-related Disclosures Appendix B Industry-based disclosure requirements: Forestry Management']","['439-443', '504-505']",Sustainable management of forestry products links directly to the chemicals industry’s need for renewable and environmentally-friendly feedstocks.,"['b41-forestry-management', 'b47-chemicals']"
Cross-Industry Comparison,How do the climate change adaptation strategies differ between the Forestry Management and Chemicals industries according to the IFRS sustainability reporting standards?,"Forestry Management focuses on long-term forest resilience, while Chemicals focuses on short-term emissions reduction","Chemicals emphasizes technological innovation, while Forestry Management emphasizes land use changes","Forestry Management must report on specific adaptation actions, while Chemicals only reports on general strategies","Chemicals must provide quantitative targets, while Forestry Management only provides qualitative descriptions",Both industries have identical requirements for reporting climate change adaptation strategies,"A: Forestry Management focuses on long-term forest resilience, while Chemicals focuses on short-term emissions reduction","The Forestry Management industry is required to describe long-term strategies to manage climate change risks and opportunities, including forest productivity and resilience (RR-FM-450a.1). In contrast, the Chemicals industry standards emphasize short-term and long-term strategies to manage Scope 1 emissions and reduction targets (RT-CH-110a.2), focusing more on immediate emissions reduction rather than long-term ecosystem adaptation.","['IFRS S2 Climate-related Disclosures Appendix B Industry-based disclosure requirements: Chemicals', 'IFRS S2 Climate-related Disclosures Appendix B Industry-based disclosure requirements: Forestry Management']","['444-446', '494-496']",Sustainable management of forestry products links directly to the chemicals industry’s need for renewable and environmentally-friendly feedstocks.,"['b41-forestry-management', 'b47-chemicals']"
